id;departemen_id;foto;judul;deskripsi
240;35;d35-fasilitas6.jpg;Ruang himpunan;Ruang himpunan adalah fasilitas yang disediakan khusus sebagai tempat kerja mahasiswa Himpunan Mahasiswa Teknik Geofisika (HMTG) ITS.
241;35;d35-fasilitas7.jpg;Kelas alam atau capstone;Kelas alam atau capstone digunakan dalam kuliah lapangan teknik geofisika ITS.
242;36;d36-fasilitas1.jpg;Laboratorium Transportasi dan Geoteknik (LTG);Diketuai oleh Ir. Agung Budipriyanto, M.Eng., Ph D.. Terdiri dari 2 lab yaitu: Laboratorium Uji Bahan Jalan dan Laboratorium Uji Tanah
243;36;d36-fasilitas2.jpg;Laboratorium Hidrologi dan Surveying (LHS);Diketuai oleh S. Kamilia Aziz, ST., MT. Terdiri dari 2 lab yaitu: Laboratorium Ukur Tanah dan Laboratorium Hidrologi dan Hidrolika
244;36;d36-fasilitas3.jpg;Laboratorium Material dan Struktur Gedung (LMSG);Diketuai oleh  Ir. Ridho Bayuaji, ST, MT., Ph.D., IPM., ASEAN Eng.
245;36;d36-fasilitas4.jpg;Laboratorium Manajemen Pelaksanaan Konstruksi (LMPK);Laboratorium Manajemen Pelaksanaan Konstruksi (LMPK) mempunyai TUK K3 Konstruksi dan materi metode penjadwalan dan pelaksanaan konstruksi.
246;36;d36-fasilitas5.jpg;Ruang serba guna;Dilengkapi dengan fasilitas audio visual yang mumpuni untuk menunjang kegiatan belajar mengajar mahasiswa termasuk seminar dan kuliah tamu yang mampu menampung 100 mahasiswa.
247;36;d36-fasilitas6.jpg;Gazebo dan Taman Terbuka Hijau;Gazebo dan taman terbuka hijau supaya memberikan suasana kondusif selama berlangsungnya masa perkuliahan maupun pembelajaran, selain itu tersedia juga masjid untuk kegiatan beribadah dan kajian kajian agama serta untuk kegiatan organisasi keagamaan mahasiswa.
248;37;d37-fasilitas1.jpg;Lab Manufaktur;Laboratorium Manufaktur berfungsi sebagai penunjang mata kuliah Proses Manufaktur serta praktikum yang meliputi Praktikum Ilmu Logam, Ilmu Bahan dan Material Metalurgi.
249;37;d37-fasilitas2.jpg;Lab Konversi Energi;Laboratorium ini berfokus pada riset, pembelajaran dan pelayanan hal hal yang terkait dengan proses dan peralatan pengubah energi fluida dari satu bentuk ke bentuk lain yang dapat dimanfaatkan.
250;37;d37-fasilitas3.jpg;Lab Perancangan Mekanik;Kalab: Ir. Budi Luwar Sanyoto, MT
251;37;d37-fasilitas4.jpg;Lab Material Teknik dan Metalurgi;Laboratorium Material Teknik dan Metalurgi berfungsi untuk mendukung praktikum dan penelitian.
252;37;d37-fasilitas5.jpg;Ruang Baca;Ruang Baca Teknik Mesin Industri (RBcTMI) merupakan salah satu fasilitas yang disediakan oleh Departemen Teknik Mesin Industri untuk mahasiswa serta civitas akademik dalam hal layanan peminjaman, pengembalian, pemanjangan, serta berbagai koleksi bahan pustaka penunjang proses belajar mengajar di Departemen.
253;37;d37-fasilitas6.jpg;Ruang Kelas;Kelas yang dilengkapi dengan fasilitias penunjang seperti LCD projector, laptop, koneksi internet, kursi, meja, papan tulis, dan AC.
254;38;d38-fasilitas1.jpg;Laboratorium Programmable Logic Controller dan Sistem Kontrol Supervisori;Kalab: Ir. Joko Susila, M.T.
255;38;d38-fasilitas2.jpg;Laboratorium Cyber Physical Otomasi dan Robot Industri;Kalab: Imam Arifin, ST., MT.
256;38;d38-fasilitas3.jpg;Laboratorium Mikroelektronika dan Sistem Embedded;Kalab: Ir. Arif Mustofa, MT.
257;38;d38-fasilitas4.jpg;Lab Motor Penggerak dan Sistem Elektronika Daya;Memiliki peralatan-peralatan terkait dengan motor, mesin-mesin penggerak listrik, dan elektronika daya.
258;39;d39-fasilitas1.jpg;Laboratorium Sistem Operasi Proses;Kalab: Prof. Dr. Ir. Danawati Hari Prajitno, M.Pd. Lab ini yang memiliki fokusan di bidang instrumen pada industri
259;39;d39-fasilitas2.jpg;Laboratorium Bioteknologi Industri;Kalab: Saidah Altway, ST, MT, MSc. Lab yang memiliki fokusan tentang pengolahan Limbah
260;39;d39-fasilitas3.jpg;Laboratorium Kimia Terapan;Kalab: Achmad Ferdiansyah Pradana Putra, ST., MT. Lab yang memiliki fokusan tentang aplikasi kimia terapan kehidupan sehari hari
261;39;d39-fasilitas4.jpg;Laboratorium Proses Industri Kimia;Lab yang memiliki fokusan pada optimasi proses di industri
262;39;d39-fasilitas5.jpg;Ruang baca;Ruang Baca berfungsi sebagai pusat kegiatan belajar mengajar, pusat penelitian dan pusat informasi bagi pelaksanaan Tri Dharma Perguruan Tinggi dengan tugas melaksanakan pengelolaan Ruang Baca serta menyiapkan, menyajikan bahan pustaka serta pelayanan perpustakaan dan bertanggung jawab dalam pemeliharaan, pengolahan bahan pustaka dan sarana perpustakaan.
263;39;d39-fasilitas6.jpg;Ruang kelas;Semua kelas yang ada di Departemen  Teknik Kimia Industri Fakultas Vokasi ITS sudah dilengkapi dengan LCD Projector, AC, dan Wifi guna menunjang kelancaran proses belajar mengajar.
264;40;d40-fasilitas1.jpg;Lab Instrumentasi Pengendalian;Kalab: Dr.Ir Totok Soehartanto,DEA
265;40;d40-fasilitas2.jpg;Lab Safety Instrumentation System;Kalab: Sefi Novendra Patrialova
266;40;d40-fasilitas3.jpg;Lab Teknik Pengukuran;Kalab: Herry Sufyan H., S.T., M.T.
267;40;d40-fasilitas4.jpg;Ruang sidang;Fasilitas ini didukung oleh: Proyektor, Wireless Microphone dan Sound System, Pendingin ruangan, dan Akses internet Wi-Fi
268;40;d40-fasilitas5.jpg;Ruang kelas;Fasilitas ini didukung dengan proyektor, akses internet WiFi, dan pendingin ruangan
269;40;d40-fasilitas6.jpg;Smart classroom;Smart classroom dapat digunakan untuk menyelenggarakan perkuliahan dengan sistem hybrid (dua saluran yakni luring dan daring).
270;41;d41-fasilitas1.jpg;Lab Statistika Bisnis-Analitik;Bisnis analitik merupakan istilah untuk sekumpulan  keterampilan, teknologi, dan eksplorasi data bisnis masa lalu untuk mendapatkan wawasan dan arah  perencanaan bisnis.
271;41;d41-fasilitas2.jpg;Lab Statistika Rekayasa Kualitas dan Produktivitas;Kualitas dan produktivitas merupakan hal penting dalam setiap jenis dan sektor industry baik jasa maupun barang.
272;41;d41-fasilitas3.jpg;Ruang baca;Ruang Baca Statistika Bisnis merupakan salah satu fasilitas yang disediakan oleh Departemen Statistika ITS untuk mahasiswa serta civitas akademik dalam hal layanan peminjaman, pengembalian, pemanjangan, berbagai koleksi pustaka penunjang proses belajar mengajar di Departemen Statistika Bisnis ITS.
273;41;d41-fasilitas4.jpg;Ruang kelas;Departemen Statistika Bisnis telah menyediakan tiga ruang kelas dengan fasilitas AC dan LCD Proyektor.
